Rank,RelevanceScore,SuggestedSection,Title,Authors,Year,Venue,Citations,Source,Cluster,DOI,URL,Abstract
67,28.5,"RW:Architecture, RW:MedicalSegmentation",A Deep Learning-Based Automatic Segmentation and 3D Visualization Technique for Intracranial Hemorrhage Detection Using Computed Tomography Images.,Muntakim Mahmud Khan; Muhammad E H Chowdhury; A S M Shamsul Arefin; Kanchon Kanti Podder,2023,"Diagnostics (Basel, Switzerland)",0,PubMed,masked_image_modeling_medical,10.3390/diagnostics13152537,https://pubmed.ncbi.nlm.nih.gov/37568900/,"Intracranial hemorrhage (ICH) occurs when blood leaks inside the skull as a result of trauma to the skull or due to medical conditions. ICH usually requires immediate medical and surgical attention because the disease has a high mortality rate, long-term disability potential, and other potentially life-threatening complications. There are a wide range of severity levels, sizes, and morphologies of..."
68,28.5,"RW:Architecture, RW:MedicalSegmentation",Inpainting surgical occlusion from laparoscopic video sequences for robot-assisted interventions.,S M Kamrul Hasan; Richard A Simon; Cristian A Linte,2023,"Journal of medical imaging (Bellingham, Wash.)",0,PubMed,masked_image_modeling_medical,10.1117/1.JMI.10.4.045002,https://pubmed.ncbi.nlm.nih.gov/37649957/,"Medical technology for minimally invasive surgery has undergone a paradigm shift with the introduction of robot-assisted surgery. However, it is very difficult to track the position of the surgical tools in a surgical scene, so it is crucial to accurately detect and identify surgical tools. This task can be aided by deep learning-based semantic segmentation of surgical video frames. Furthermore, d..."
69,28.5,RW:SelfSupervisedLearning,Learning the heterogeneous representation of brain's structure from serial SEM images using a masked autoencoder.,Ao Cheng; Jiahao Shi; Lirong Wang; Ruobing Zhang,2023,Frontiers in neuroinformatics,0,PubMed,masked_image_modeling_medical,10.3389/fninf.2023.1118419,https://pubmed.ncbi.nlm.nih.gov/37360945/,"The exorbitant cost of accurately annotating the large-scale serial scanning electron microscope (SEM) images as the ground truth for training has always been a great challenge for brain map reconstruction by deep learning methods in neural connectome studies. The representation ability of the model is strongly correlated with the number of such high-quality labels. Recently, the masked autoencode..."
70,28.0,"RW:Architecture, RW:KnowledgeDistillation, RW:MedicalSegmentation",Lightweight TransUNet with knowledge distillation for efficient medical image segmentation,Husain Al Yusuf; Jayant Biradar; Eung-Joo Lee,2025,Defense + Security,2,Semantic Scholar,knowledge_distillation_medical_segmentation,10.1117/12.3054578,https://www.semanticscholar.org/paper/2541033c996e07aa82a8c32fbbabc2a4d5aeb21b,"Recent advances in computer-assisted interventions and postoperative surgical video analysis have advanced significantly, contributing to improvements in surgical planning, skill assessments, and training. These advances have transformed the surgical landscape by enabling near real-time segmentation of medical images and providing decision support systems that offer critical guidance and assistanc..."
71,28.0,RW:Architecture,Automatic and observable spinal cord compression grading system for lung cancer spinal metastasis.,Gengyuan Wang; Guanquan Lai; Genghui Wang; Yu Zhang,2025,Quantitative imaging in medicine and surgery,0,PubMed,masked_image_modeling_medical,10.21037/qims-2025-922,https://pubmed.ncbi.nlm.nih.gov/41209182/,"Epidural spinal cord compression (ESCC) assessment is a critical step in surgical intervention for lung cancer spinal metastasis. However, clinicians can only assess compression grades through manual observation, which is subjective and inefficient. The metastatic cancer features on magnetic resonance imaging (MRI) slices are complex and difficult to identify, and there are no publicly labeled dat..."
72,28.0,RW:MedicalSegmentation,Self-Attention Diffusion Models for Zero-Shot Biomedical Image Segmentation: Unlocking New Frontiers in Medical Imaging.,Abderrachid Hamrani; Anuradha Godavarty,2025,"Bioengineering (Basel, Switzerland)",0,PubMed,masked_image_modeling_medical,10.3390/bioengineering12101036,https://pubmed.ncbi.nlm.nih.gov/41155035/,"Producing high-quality segmentation masks for medical images is a fundamental challenge in biomedical image analysis. Recent research has investigated the use of supervised learning with large volumes of labeled data to improve segmentation across medical imaging modalities and unsupervised learning with unlabeled data to segment without detailed annotations. However, a significant hurdle remains ..."
73,28.0,RW:Architecture,Development and validation of a deep learning model using MR imaging for predicting brain metastases: an accuracy-focused study.,Dan Shi; Meng Yang; Min Dong; Ning Xuan,2025,Frontiers in oncology,0,PubMed,masked_image_modeling_medical,10.3389/fonc.2025.1657604,https://pubmed.ncbi.nlm.nih.gov/41064092/,"Brain metastases (BM), originating from extracranial malignancies, significantly threaten patient health. Accurate BM identification is crucial but labor-intensive manually. This study developed and validated a system for BM diagnosis, assessing its performance and stability. 470 patients diagnosed with BM were divided into an 80% training set (n=379) and a 20% internal test set (n=91) using syste..."
74,28.0,RW:MedicalSegmentation,SAM-guided Cross Pseudo Supervision Learning for Semi-supervised Medical Image Segmentation.,Junhao Li; Yun Li; Xiaomao Fan; Wenbin Lei,2025,Annual International Conference of the IEEE Engineering in Medicine and Biology Society. IEEE Engineering in Medicine and Biology Society. Annual International Conference,0,PubMed,masked_image_modeling_medical,10.1109/EMBC58623.2025.11254895,https://pubmed.ncbi.nlm.nih.gov/41335733/,"Precise identification of lesions in medical images is crucial for accurate diagnosis and successful treatment. Nevertheless, the limited availability of annotations, coupled with the intricate nature of lesion characteristics, imposes significant constraints on the model's representational capacity. The recently developed vision foundation model, Segment Anything Model (SAM), featuring its unique..."
75,28.0,"RW:SelfSupervisedLearning, RW:MedicalSegmentation",Medical Transformer: Universal Encoder for 3-D Brain MRI Analysis.,Eunji Jun; Seungwoo Jeong; Da-Woon Heo; Heung-Il Suk,2024,IEEE transactions on neural networks and learning systems,0,PubMed,masked_image_modeling_medical,10.1109/TNNLS.2023.3308712,https://pubmed.ncbi.nlm.nih.gov/37738193/,"Transfer learning has attracted considerable attention in medical image analysis because of the limited number of annotated 3-D medical datasets available for training data-driven deep learning models in the real world. We propose Medical Transformer, a novel transfer learning framework that effectively models 3-D volumetric images as a sequence of 2-D image slices. To improve the high-level repre..."
76,28.0,"RW:SelfSupervisedLearning, RW:MedicalSegmentation",Self-supervised learning for chest computed tomography: training strategies and effect on downstream applications.,Amara Tariq; Gokul Ramasamy; Bhavik Patel; Imon Banerjee,2024,"Journal of medical imaging (Bellingham, Wash.)",0,PubMed,masked_image_modeling_medical,10.1117/1.JMI.11.6.064003,https://pubmed.ncbi.nlm.nih.gov/39529658/,"Self-supervised pre-training can reduce the amount of labeled training data needed by pre-learning fundamental visual characteristics of the medical imaging data. We investigate several self-supervised training strategies for chest computed tomography exams and their effects on downstream applications. We benchmark five well-known self-supervision strategies (masked image region prediction, next s..."
77,28.0,General,Fully automated explainable abdominal CT contrast media phase classification using organ segmentation and machine learning.,Yazdan Salimi; Zahra Mansouri; Ghasem Hajianfar; Amirhossein Sanaat,2024,Medical physics,0,PubMed,masked_image_modeling_medical,10.1002/mp.17076,https://pubmed.ncbi.nlm.nih.gov/38629779/,"Contrast-enhanced computed tomography (CECT) provides much more information compared to non-enhanced CT images, especially for the differentiation of malignancies, such as liver carcinomas. Contrast media injection phase information is usually missing on public datasets and not standardized in the clinic even in the same region and language. This is a barrier to effective use of available CECT ima..."
78,28.0,"RW:KnowledgeDistillation, RW:MedicalSegmentation, RW:FederatedLearning",pFedSAM: Personalized Federated Learning of Segment Anything Model for Medical Image Segmentation,Tong Wang; Xingyue Zhao; Linghao Zhuang; Haoyu Zhao,2025,arXiv.org,0,Semantic Scholar,knowledge_distillation_medical_segmentation,10.48550/arXiv.2509.15638,https://www.semanticscholar.org/paper/8351178e9104efdfff911889ce6638bc3a99bb80,"Medical image segmentation is crucial for computer-aided diagnosis, yet privacy constraints hinder data sharing across institutions. Federated learning addresses this limitation, but existing approaches often rely on lightweight architectures that struggle with complex, heterogeneous data. Recently, the Segment Anything Model (SAM) has shown outstanding segmentation capabilities; however, its mass..."
79,28.0,"RW:Architecture, RW:KnowledgeDistillation, RW:MedicalSegmentation",Knowledge Distillation with Student-Teacher Model for Whole Heart and Great Vessel Segmentation in Congenital Heart Disease Using CT-Scan Image,Syifa Salsabila Putri Priambodo; I. Ardiyanto; Nahar Taufiq,2024,"2024 International Conference on Artificial Intelligence, Blockchain, Cloud Computing, and Data Analytics (ICoABCD)",0,Semantic Scholar,knowledge_distillation_medical_segmentation,10.1109/ICoABCD63526.2024.10704464,https://www.semanticscholar.org/paper/f28719936905904a688777f93e38b87561b23b41,"Congenital Heart Disease (CHD) results from imper-fect heart anatomy during early fetal development. According to the Perhimpunan Dokter Spesialis Kardiovaskular Indonesia (PERKI), around 8–10 babies out of every 1000 births in Indonesia suffer from CHD. However, with advances in medical technology, many children with heart defects can survive. Cardiac CT-Scan images are used as the basis for appr..."
80,27.5,"RW:ContinualLearning, RW:KnowledgeDistillation",Modular Continual Learning via Zero-Leakage Reconstruction Routing and Autonomous Task Discovery,Noureddine Kermiche,2026,arXiv,0,arXiv,sparse_masked_cnn_pretraining,N/A,http://arxiv.org/abs/2604.14375v1,"Catastrophic forgetting remains a primary hurdle in sequential task learning for artificial neural networks. We propose a silicon-native modular architecture that achieves structural parameter isolation using Task-Specific Experts and a distributed, outlier-based Gatekeeper. Moving beyond traditional sequential consolidation, our framework utilizes a Simultaneous Pipeline where Teacher learning, S..."
81,27.1,"RW:Architecture, RW:KnowledgeDistillation, RW:MedicalSegmentation",ReCo-KD: Region- and Context-Aware Knowledge Distillation for Efficient 3D Medical Image Segmentation,Qizhen Lan; Yu-Chun Hsu; N. Khan; Xiaoqian Jiang,2026,arXiv.org,7,Semantic Scholar,knowledge_distillation_medical_segmentation,10.48550/arXiv.2601.08301,https://www.semanticscholar.org/paper/7f88e8b9e960e31aedaf6091efc3b2a244ca8e3c,"Accurate 3D medical image segmentation is vital for diagnosis and treatment planning, but state-of-the-art models are often too large for clinics with limited computing resources. Lightweight architectures typically suffer significant performance loss. To address these deployment and speed constraints, we propose Region- and Context-aware Knowledge Distillation (ReCo-KD), a training-only framework..."
82,27.0,"RW:SelfSupervisedLearning, RW:KnowledgeDistillation, RW:MedicalSegmentation",Unsupervised domain adaptation with multi-level distillation boost and adaptive mask for medical image segmentation,Yongze Wang; Lei Fan; M. Pagnucco; Yang Song,2025,Comput. Biol. Medicine,2,Semantic Scholar,knowledge_distillation_medical_segmentation,10.1016/j.compbiomed.2025.110055,https://www.semanticscholar.org/paper/15cd229ee456df782c6234bf3ec57f545e4f01fb,"The mean-teacher (MT) framework has emerged as a commonly used approach in unsupervised domain adaptation (UDA) tasks. Existing methods primarily focus on aligning the outputs of the student and teacher networks by using guidance from the teacher network's multi-layer features. To build upon the potential of the MT framework, we propose a framework named Multi-Level Distillation Boost (MLDB). It c..."
83,27.0,"RW:SelfSupervisedLearning, RW:MedicalSegmentation",Self-supervised learning for breast cancer detection: A review.,Hugo Figueiras; José Domingues; Nuno Matela; Nuno Garcia,2025,Computers in biology and medicine,0,PubMed,core_topic,10.1016/j.compbiomed.2025.111245,https://pubmed.ncbi.nlm.nih.gov/41138363/,"Breast cancer is one of the most prevalent and life-threatening malignancies worldwide, prompting continuous improvements in both early detection and precise diagnosis. Deep learning methods have shown promise in computer-aided detection (CAD) systems, yet they often rely on extensive labeled datasets, which are costly and time-consuming to annotate. Self-supervised learning (SSL) offers a compell..."
84,27.0,"RW:ContinualLearning, RW:SelfSupervisedLearning, RW:MedicalSegmentation",A Systematic Benchmarking Analysis of Transfer Learning for Medical Image Analysis.,Mohammad Reza Hosseinzadeh Taher; Fatemeh Haghighi; Ruibin Feng; Michael B Gotway,2021,"Domain adaptation and representation transfer, and affordable healthcare and AI for resource diverse global health : third MICCAI workshop, DART 2021 and first MICCAI workshop, FAIR 2021 : held in conjunction with MICCAI 2021 : Strasbou...",0,PubMed,core_topic,10.1007/978-3-030-87722-4_1,https://pubmed.ncbi.nlm.nih.gov/35713581/,"Transfer learning from supervised ImageNet models has been frequently used in medical image analysis. Yet, no large-scale evaluation has been conducted to benchmark the efficacy of newly-developed pre-training techniques for medical image analysis, leaving several important questions unanswered. As the first step in this direction, we conduct a systematic study on the transferability of models pre..."
85,27.0,"RW:SelfSupervisedLearning, RW:Dataset",Improving brain tumor segmentation with anatomical prior-informed pre-training.,Kang Wang; Zeyang Li; Haoran Wang; Siyu Liu,2023,Frontiers in medicine,0,PubMed,masked_image_modeling_medical,10.3389/fmed.2023.1211800,https://pubmed.ncbi.nlm.nih.gov/37771979/,"Precise delineation of glioblastoma in multi-parameter magnetic resonance images is pivotal for neurosurgery and subsequent treatment monitoring. Transformer models have shown promise in brain tumor segmentation, but their efficacy heavily depends on a substantial amount of annotated data. To address the scarcity of annotated data and improve model robustness, self-supervised learning methods usin..."
86,27.0,RW:SelfSupervisedLearning,Prompt-Guided Image Editing with Masked Logit Nudging in Visual Autoregressive Models,Amir El-Ghoussani; Marc Hölle; Gustavo Carneiro; Vasileios Belagiannis,2026,arXiv,0,arXiv,sparse_masked_cnn_pretraining,N/A,http://arxiv.org/abs/2604.14591v1,"We address the problem of prompt-guided image editing in visual autoregressive models. Given a source image and a target text prompt, we aim to modify the source image according to the target prompt, while preserving all regions which are unrelated to the requested edit. To this end, we present Masked Logit Nudging, which uses the source image token maps to introduce a guidance step that aligns th..."
87,27.0,"RW:ContinualLearning, RW:KnowledgeDistillation, RW:MedicalSegmentation, RW:Dataset",DINO-Mix: Distilling Foundational Knowledge with Cross-Domain CutMix for Semi-supervised Class-imbalanced Medical Image Segmentation,Xinyu Liu; Guolei Sun,2026,arXiv.org,0,Semantic Scholar,knowledge_distillation_medical_segmentation,10.48550/arXiv.2602.07819,https://www.semanticscholar.org/paper/68f58738784ef64f905667dcb2135dbdfd9fb3d5,"Semi-supervised learning (SSL) has emerged as a critical paradigm for medical image segmentation, mitigating the immense cost of dense annotations. However, prevailing SSL frameworks are fundamentally""inward-looking"", recycling information and biases solely from within the target dataset. This design triggers a vicious cycle of confirmation bias under class imbalance, leading to the catastrophic f..."
88,26.6,"RW:Architecture, RW:KnowledgeDistillation, RW:MedicalSegmentation",Efficient Multi-Organ Segmentation From 3D Abdominal CT Images With Lightweight Network and Knowledge Distillation,Qianfei Zhao; Lanfeng Zhong; Jianghong Xiao; Jingbo Zhang,2023,IEEE Transactions on Medical Imaging,29,Semantic Scholar,knowledge_distillation_medical_segmentation,10.1109/TMI.2023.3262680,https://www.semanticscholar.org/paper/5610c804ffdf45ef655a72cccc1674745a22ff56,"Accurate segmentation of multiple abdominal organs from Computed Tomography (CT) images plays an important role in computer-aided diagnosis, treatment planning and follow-up. Currently, 3D Convolution Neural Networks (CNN) have achieved promising performance for automatic medical image segmentation tasks. However, most existing 3D CNNs have a large set of parameters and huge floating point operati..."
89,26.5,RW:MedicalSegmentation,AASeg: Artery-Aware Global-to-Local Framework for Aneurysm Segmentation in Head and Neck CTA Images.,Linlin Yao; Dongdong Chen; Xiangyu Zhao; Manman Fei,2025,IEEE transactions on medical imaging,0,PubMed,masked_image_modeling_medical,10.1109/TMI.2024.3496194,https://pubmed.ncbi.nlm.nih.gov/39527438/,"Aneurysm segmentation in computed tomography angiography (CTA) images is essential for medical intervention aimed at preventing subarachnoid hemorrhages. However, most existing studies tend to overlook the topological characteristics of arteries related to aneurysms, often resulting in suboptimal performance in aneurysm segmentation. To address this challenge, we propose an artery-aware global-to-..."
90,26.5,"RW:KnowledgeDistillation, RW:MedicalSegmentation",Efficient Knowledge Distillation of SAM for Medical Image Segmentation,K. D. Patil; Gowthamaan Palani; Ganapathy Krishnamurthi,2025,arXiv.org,0,Semantic Scholar,knowledge_distillation_medical_segmentation,10.48550/arXiv.2501.16740,https://www.semanticscholar.org/paper/02e1ac1b3ad9d3758001a2be5d5dca3ab4720ab9,"The Segment Anything Model (SAM) has set a new standard in interactive image segmentation, offering robust performance across various tasks. However, its significant computational requirements limit its deployment in real-time or resource-constrained environments. To address these challenges, we propose a novel knowledge distillation approach, KD SAM, which incorporates both encoder and decoder op..."
91,26.5,"RW:Architecture, RW:KnowledgeDistillation, RW:MedicalSegmentation",Enhancing Medical Image Segmentation with Attention-Based Knowledge Distillation,Boxiao Yin; H. Liao; Zhiqing Tang; Jianxiong Guo,2025,2025 International Conference on Sensor-Cloud and Edge Computing System (SCECS),0,Semantic Scholar,knowledge_distillation_medical_segmentation,10.1109/SCECS65243.2025.11064934,https://www.semanticscholar.org/paper/9952ee75c77d11879baca67c0407b659aec13f4a,"Medical image segmentation plays a critical role in healthcare, enabling accurate analysis and diagnosis through precise identification of tissues and lesions. However, existing U-Net-based segmentation models face significant challenges, including issues with data generalization and high computational resource consumption. To address these challenges, we propose a novel framework that integrates ..."
92,26.5,"RW:KnowledgeDistillation, RW:MedicalSegmentation",SAM-AEKD: SAM-Based Knowledge Distillation with Adaptive Fusion and Edge Features for Enhancing Medical Image Segmentation,Shirong Zhou; Xing Wu; Chengliang Wang; Lingqiu Zeng,2025,IEEE International Joint Conference on Neural Network,0,Semantic Scholar,knowledge_distillation_medical_segmentation,10.1109/IJCNN64981.2025.11228296,https://www.semanticscholar.org/paper/c68dc6c62474813a712f05b523f6f438c1aa3bd6,"Semantic segmentation models have made significant progress by optimizing for the characteristics of medical images, but their accuracy and generalization ability still need improvement. The vision foundation model SAM excels in segmentation accuracy and generalization, but its performance drops significantly when directly applied to medical image segmentation due to its training on natural images..."
93,26.5,"RW:KnowledgeDistillation, RW:MedicalSegmentation",SAM-Teacher: SAM can be a Good Teacher for Enhancing Medical Image Segmentation,Lan Li; Xing Wu; Dejian Fang; Zhongshi He,2025,"IEEE International Conference on Systems, Man and Cybernetics",0,Semantic Scholar,knowledge_distillation_medical_segmentation,10.1109/SMC58881.2025.11343205,https://www.semanticscholar.org/paper/585e3b04b0fd24ed25425ef91bb99361473eeaef,"Medical image segmentation has improved with advances in model architectures and feature extraction, yet current SOTA models still face challenges in generalization and accuracy. The vision foundation model SAM demonstrates strong segmentation precision and zero-shot generalization on natural images. However, due to domain gaps, SAM, even when fine-tuned or used as a backbone, underperforms compar..."
94,26.5,"RW:KnowledgeDistillation, RW:MedicalSegmentation",Medical Image Segmentation of Liver Tumors with Multi-phase Deficiency Based on Hierarchical Knowledge Distillation Network,Shen Deng; Xinde Li; Chuanfei Hu,2024,Cybersecurity and Cyberforensics Conference,0,Semantic Scholar,knowledge_distillation_medical_segmentation,10.23919/CCC63176.2024.10662548,https://www.semanticscholar.org/paper/5481aa59f13363c80d2add0d06bfb0400c018d83,"Contrast-enhanced Computed Tomography (CT)-based multi-phase liver tumor medical image segmentation is one of the important methods of liver cancer diagnosis. However, the multiply phases of patients might be incomplete clinically, resulting in the clinical limitation of multi-phase liver tumor medical image segmentation. Recently, the knowledge distillation-based incomplete multi-phase/modal meth..."
95,26.5,"RW:KnowledgeDistillation, RW:MedicalSegmentation",RETHINKING INTERMEDIATE LAYERS DESIGN IN KNOWLEDGE DISTILLATION FOR KIDNEY AND LIVER TUMOR SEGMENTATION.,Vandan Gorade; Sparsh Mittal; Debesh Jha; Ulas Bagci,2024,ArXiv,0,PubMed,knowledge_distillation_medical_segmentation,N/A,https://pubmed.ncbi.nlm.nih.gov/38855539/,"Knowledge distillation (KD) has demonstrated remarkable success across various domains, but its application to medical imaging tasks, such as kidney and liver tumor segmentation, has encountered challenges. Many existing KD methods are not specifically tailored for these tasks. Moreover, prevalent KD methods often lack a careful consideration of 'what' and 'from where' to distill knowledge from th..."
96,26.0,"RW:SelfSupervisedLearning, RW:KnowledgeDistillation",AdaHet-MKD: An Adaptive Heterogeneous Multi-teacher Knowledge Distillation for Medical Image Analysis,Helin Wang; Wei Du; Ning Liu; Qian Li,2025,International Conference on Information and Knowledge Management,1,Semantic Scholar,knowledge_distillation_medical_segmentation,10.1145/3746252.3761176,https://www.semanticscholar.org/paper/a3027abcfd680ee71e4a50ab4c6fa9d4a74e8c66,"Contrastive Language-Image Pre-training (CLIP) has emerged as an effective framework for multi-modal representation learning, achieving notable success in diverse tasks such as medical image analysis. CLIP's growing prominence in medical image applications is restricted by its significant computational demands, creating implementation challenges in resource-constrained clinical environments. While..."
97,26.0,RW:MedicalSegmentation,"AbdomenAtlas: A large-scale, detailed-annotated, & multi-center dataset for efficient transfer learning and open algorithmic benchmarking.",Wenxuan Li; Chongyu Qu; Xiaoxi Chen; Pedro R A S Bassi,2024,Medical image analysis,0,PubMed,masked_image_modeling_medical,10.1016/j.media.2024.103285,https://pubmed.ncbi.nlm.nih.gov/39116766/,"We introduce the largest abdominal CT dataset (termed AbdomenAtlas) of 20,460 three-dimensional CT volumes sourced from 112 hospitals across diverse populations, geographies, and facilities. AbdomenAtlas provides 673 K high-quality masks of anatomical structures in the abdominal region annotated by a team of 10 radiologists with the help of AI algorithms. We start by having expert radiologists man..."
98,26.0,RW:SelfSupervisedLearning,DART: DEFORMABLE ANATOMY-AWARE REGISTRATION TOOLKIT FOR LUNG CT REGISTRATION WITH KEYPOINTS SUPERVISION.,Yunzheng Zhu; Luoting Zhuang; Yannan Lin; Tengyue Zhang,2024,Proceedings. IEEE International Symposium on Biomedical Imaging,0,PubMed,masked_image_modeling_medical,10.1109/ISBI56570.2024.10635326,https://pubmed.ncbi.nlm.nih.gov/39309597/,"Spatially aligning two computed tomography (CT) scans of the lung using automated image registration techniques is a challenging task due to the deformable nature of the lung. However, existing deep-learning-based lung CT registration models are not trained with explicit anatomical knowledge. We propose the deformable anatomy-aware registration toolkit (DART), a masked autoencoder (MAE)-based appr..."
