Rank,RelevanceScore,SuggestedSection,Title,Authors,Year,Venue,Citations,Source,Cluster,DOI,URL,Abstract
99,26.0,"RW:SelfSupervisedLearning, RW:KnowledgeDistillation, RW:MedicalSegmentation",Multi-Task Multi-Scale Contrastive Knowledge Distillation for Efficient Medical Image Segmentation,Risab Biswas,2024,arXiv.org,0,Semantic Scholar,knowledge_distillation_medical_segmentation,10.48550/arXiv.2406.03173,https://www.semanticscholar.org/paper/08eff912a4a5c6ff675ff0695365e61b6abc068f,"This thesis aims to investigate the feasibility of knowledge transfer between neural networks for medical image segmentation tasks, specifically focusing on the transfer from a larger multi-task""Teacher""network to a smaller""Student""network. In the context of medical imaging, where the data volumes are often limited, leveraging knowledge from a larger pre-trained network could be useful. The primar..."
100,25.7,"RW:KnowledgeDistillation, RW:MedicalSegmentation",InterTeach: A Novel Approach for Semi-Supervised Medical Image Segmentation Using Cooperative Teacher–Student Networks,Ziyao Zhang; Qiankun Ma; Yihan Zhang; Zeyuan Chen,2026,IEEE transactions on circuits and systems for video technology (Print),12,Semantic Scholar,knowledge_distillation_medical_segmentation,10.1109/TCSVT.2024.3458936,https://www.semanticscholar.org/paper/d2bab97a012c25dcb6921a78f00385e58b34eba3,"In medical image segmentation, the reliance on extensive, high-quality labeled datasets poses a significant challenge, especially considering the associated costs and the requirement for specialized expertise. In response, the field has progressively embraced semi-supervised learning (SSL) methods that leverage both labeled and unlabeled data. Nonetheless, these methods frequently encounter issues..."
101,25.3,"RW:KnowledgeDistillation, RW:MedicalSegmentation, RW:Dataset",MSKD: Structured knowledge distillation for efficient medical image segmentation,Libo Zhao; Xiao-liang Qian; Yinghui Guo; Jiaqi Song,2023,Comput. Biol. Medicine,42,Semantic Scholar,knowledge_distillation_medical_segmentation,10.1016/j.compbiomed.2023.107284,https://www.semanticscholar.org/paper/405f8775251607388c941e67996e4eb94523475e,"In recent years, deep learning has revolutionized the field of medical image segmentation by enabling the development of powerful deep neural networks. However, these models tend to be complex and computationally demanding, posing challenges for practical implementation in clinical settings. To address this issue, we propose an efficient structured knowledge distillation framework that leverages a..."
102,25.3,"RW:KnowledgeDistillation, RW:MedicalSegmentation","Knowledge distillation and teacher-student learning in medical imaging: Comprehensive overview, pivotal role, and future directions",Xiang Li; Like Li; Minglei Li; Pengfei Yan,2025,Medical Image Anal.,15,Semantic Scholar,knowledge_distillation_medical_segmentation,10.1016/j.media.2025.103819,https://www.semanticscholar.org/paper/34dfdaf402c38f41af9248850b823b3962dbd5a4,"Knowledge Distillation (KD) is a technique to transfer the knowledge from a complex model to a simplified model. It has been widely used in natural language processing and computer vision and has achieved advanced results. Recently, the research of KD in medical image analysis has grown rapidly. The definition of knowledge has been further expanded by combining with the medical field, and its role..."
103,25.3,"RW:KnowledgeDistillation, RW:MedicalSegmentation",Light-M: An efficient lightweight medical image segmentation framework for resource-constrained IoMT,Yifan Zhang; Zhuangzhuang Chen; Xuan Yang,2024,Comput. Biol. Medicine,15,Semantic Scholar,knowledge_distillation_medical_segmentation,10.1016/j.compbiomed.2024.108088,https://www.semanticscholar.org/paper/b5543afed4212b3fc2c3e0ab825b400fb4b7f227,"The Internet of Medical Things (IoMT) is being incorporated into current healthcare systems. This technology intends to connect patients, IoMT devices, and hospitals over mobile networks, allowing for more secure, quick, and convenient health monitoring and intelligent healthcare services. However, existing intelligent healthcare applications typically rely on large-scale AI models, and standard I..."
104,25.0,"RW:KnowledgeDistillation, RW:MedicalSegmentation",G-MBRMD: Lightweight liver segmentation model based on guided teaching with multi-head boundary reconstruction mapping distillation,Bo Huang; Hongxu Li; Hamido Fujita; Xiaoning Sun,2024,Comput. Biol. Medicine,2,Semantic Scholar,knowledge_distillation_medical_segmentation,10.1016/j.compbiomed.2024.108733,https://www.semanticscholar.org/paper/2287ac8a14afd65e2e2ebb8174e5175b5bc6d40b,"BACKGROUND AND OBJECTIVES
Liver segmentation is pivotal for the quantitative analysis of liver cancer. Although current deep learning methods have garnered remarkable achievements for medical image segmentation, they come with high computational costs, significantly limiting their practical application in the medical field. Therefore, the development of an efficient and lightweight liver segmentat..."
105,25.0,"RW:SelfSupervisedLearning, RW:MedicalSegmentation",Neural implicit surface reconstruction of freehand 3D ultrasound volume with geometric constraints.,Hongbo Chen; Logiraj Kumaralingam; Shuhang Zhang; Sheng Song,2024,Medical image analysis,0,PubMed,core_topic,10.1016/j.media.2024.103305,https://pubmed.ncbi.nlm.nih.gov/39168075/,"Three-dimensional (3D) freehand ultrasound (US) is a widely used imaging modality that allows non-invasive imaging of medical anatomy without radiation exposure. Surface reconstruction of US volume is vital to acquire the accurate anatomical structures needed for modeling, registration, and visualization. However, traditional methods cannot produce a high-quality surface due to image noise. Despit..."
106,25.0,RW:MedicalSegmentation,BoxCell: Leveraging SAM for Cell Segmentation with Box Supervision.,Aayush Kumar Tyagi; Vaibhav Mishra; Prathosh A P; Mausam,2025,Scientific reports,0,PubMed,masked_image_modeling_medical,10.1038/s41598-025-26789-1,https://pubmed.ncbi.nlm.nih.gov/41274955/,"Cell segmentation in histopathological images is vital for diagnosis, and treatment of several diseases. Annotating data is tedious, and requires medical expertise, making it difficult to employ supervised learning. Instead, we study a weakly supervised setting, where only bounding box supervision is available, and present the use of Segment Anything (SAM) for this without any finetuning, i.e., di..."
107,25.0,General,SwinCVS: a unified approach to classifying critical view of safety structures in laparoscopic cholecystectomy.,Franciszek M Nowak; Evangelos B Mazomenos; Brian Davidson; Matthew J Clarkson,2025,International journal of computer assisted radiology and surgery,0,PubMed,masked_image_modeling_medical,10.1007/s11548-025-03354-9,https://pubmed.ncbi.nlm.nih.gov/40216728/,"Laparoscopic cholecystectomy is one of the most commonly performed surgeries in the UK. Despite its safety, the volume of operations leads to a notable number of complications, with surgical errors often mitigated by the critical view of safety (CVS) technique. However, reliably achieving CVS intraoperatively can be challenging. Current state-of-the-art models for automated CVS evaluation rely on ..."
108,25.0,RW:SelfSupervisedLearning,Masked image modeling in medical hyperspectral imaging: reconstruction evaluation and downstream tasks.,Kelden Pruitt; Hemanth Pasupuleti; James Yu; Weston DeAtley,2025,Proceedings of SPIE--the International Society for Optical Engineering,0,PubMed,masked_image_modeling_medical,10.1117/12.3048802,https://pubmed.ncbi.nlm.nih.gov/41267884/,"Self-supervised pre-training has been shown to improve deep learning networks in various tasks including natural language processing and computer vision. While this approach has shown promise in various fields, more development and translation need to be dedicated to medical imaging applications. Current literature scarcely focuses on thorough assessment of implemented pre-training approaches as w..."
109,25.0,General,Attention-Gated Convolutional Networks for Scanner-Agnostic Quality Assessment,Chinmay Bakhale; Anil Sao,2026,arXiv,0,arXiv,sparse_masked_cnn_pretraining,N/A,http://arxiv.org/abs/2604.15059v1,"Motion artifacts present a significant challenge in structural MRI (sMRI), often compromising clinical diagnostics and large-scale automated analysis. While manual quality control (QC) remains the gold standard, it is increasingly unscalable for massive longitudinal studies. To address this, we propose a hybrid CNN-Attention framework designed for robust, site-invariant MRI quality assessment. Our..."
110,25.0,General,"Retrieve, Then Classify: Corpus-Grounded Automation of Clinical Value Set Authoring",Sumit Mukherjee; Juan Shu; Nairwita Mazumder; Tate Kernell,2026,arXiv,0,arXiv,sparse_masked_cnn_pretraining,N/A,http://arxiv.org/abs/2604.14616v1,"Clinical value set authoring -- the task of identifying all codes in a standardized vocabulary that define a clinical concept -- is a recurring bottleneck in clinical quality measurement and phenotyping. A natural approach is to prompt a large language model (LLM) to generate the required codes directly, but structured clinical vocabularies are large, version-controlled, and not reliably memorized..."
111,25.0,"RW:KnowledgeDistillation, RW:MedicalSegmentation",Class-wise restructured knowledge distillation for medical image segmentation,Jiaqing Shen; Xiangchun Yu,2024,International Conference on Image Processing and Artificial Intelligence,0,Semantic Scholar,knowledge_distillation_medical_segmentation,10.1117/12.3035297,https://www.semanticscholar.org/paper/0c8055731adebf7e914f860fd75844b94a70450f,"Knowledge distillation is an effective model compression and performance enhancement method to instruct students by delivering soft labels or features of the instructor's logits. However, different organ classes in medical images may have similarities in shape, size, texture, etc., which may lead to mutual interference between each class. To solve this problem, we propose Class-wise restructured k..."
112,25.0,"RW:SelfSupervisedLearning, RW:KnowledgeDistillation, RW:MedicalSegmentation",Efficient skin lesion segmentation with boundary distillation.,Zaifang Zhang; Boyang Lu,2024,Medical & biological engineering & computing,0,PubMed,knowledge_distillation_medical_segmentation,10.1007/s11517-024-03095-y,https://pubmed.ncbi.nlm.nih.gov/38691269/,"Medical image segmentation models are commonly known for their complex structures, which often render them impractical for use on edge computing devices and compromising efficiency in the segmentation process. In light of this, the industry has proposed the adoption of knowledge distillation techniques. Nevertheless, the vast majority of existing knowledge distillation methods are focused on the c..."
113,25.0,"RW:KnowledgeDistillation, RW:MedicalSegmentation",G-MBRMD: Lightweight liver segmentation model based on guided teaching with multi-head boundary reconstruction mapping distillation.,Bo Huang; Hongxu Li; Hamido Fujita; Xiaoning Sun,2024,Computers in biology and medicine,0,PubMed,knowledge_distillation_medical_segmentation,10.1016/j.compbiomed.2024.108733,https://pubmed.ncbi.nlm.nih.gov/38897144/,"Liver segmentation is pivotal for the quantitative analysis of liver cancer. Although current deep learning methods have garnered remarkable achievements for medical image segmentation, they come with high computational costs, significantly limiting their practical application in the medical field. Therefore, the development of an efficient and lightweight liver segmentation model becomes particul..."
114,25.0,"RW:SelfSupervisedLearning, RW:KnowledgeDistillation, RW:MedicalSegmentation",Exploring Generalizable Distillation for Efficient Medical Image Segmentation.,Xingqun Qi; Zhuojie Wu; Wenxuan Zou; Min Ren,2024,IEEE journal of biomedical and health informatics,0,PubMed,knowledge_distillation_medical_segmentation,10.1109/JBHI.2024.3385098,https://pubmed.ncbi.nlm.nih.gov/38954557/,"Efficient medical image segmentation aims to provide accurate pixel-wise predictions with a lightweight implementation framework. However, existing lightweight networks generally overlook the generalizability of the cross-domain medical segmentation tasks. In this paper, we propose Generalizable Knowledge Distillation (GKD), a novel framework for enhancing the performance of lightweight networks o..."
115,25.0,"RW:KnowledgeDistillation, RW:MedicalSegmentation",Light-M: An efficient lightweight medical image segmentation framework for resource-constrained IoMT.,Yifan Zhang; Zhuangzhuang Chen; Xuan Yang,2024,Computers in biology and medicine,0,PubMed,knowledge_distillation_medical_segmentation,10.1016/j.compbiomed.2024.108088,https://pubmed.ncbi.nlm.nih.gov/38320339/,"The Internet of Medical Things (IoMT) is being incorporated into current healthcare systems. This technology intends to connect patients, IoMT devices, and hospitals over mobile networks, allowing for more secure, quick, and convenient health monitoring and intelligent healthcare services. However, existing intelligent healthcare applications typically rely on large-scale AI models, and standard I..."
116,24.5,RW:SelfSupervisedLearning,Practical intelligent diagnostic algorithm for wearable 12-lead ECG via self-supervised learning on large-scale dataset.,Jiewei Lai; Huixin Tan; Jinliang Wang; Lei Ji,2023,Nature communications,0,PubMed,core_topic,10.1038/s41467-023-39472-8,https://pubmed.ncbi.nlm.nih.gov/37353501/,"Cardiovascular disease is a major global public health problem, and intelligent diagnostic approaches play an increasingly important role in the analysis of electrocardiograms (ECGs). Convenient wearable ECG devices enable the detection of transient arrhythmias and improve patient health by making it possible to seek intervention during continuous monitoring. We collected 658,486 wearable 12-lead ..."
117,24.5,General,Benchmarking HEp-2 cell segmentation methods in indirect immunofluorescence images - standard models to deep learning.,Balaji Iyer; Smruti Deoghare; Krish Ranjan; Bruce J Aronow,2025,Computers in biology and medicine,0,PubMed,masked_image_modeling_medical,10.1016/j.compbiomed.2025.110150,https://pubmed.ncbi.nlm.nih.gov/40288291/,"Indirect Immunofluorescence (IIF) stained Human Epithelial (HEp-2) cells are considered the gold standard for detecting autoimmune diseases. Accurate cell segmentation, though often viewed as an intermediary step to downstream tasks like classification, significantly enhances overall performance when executed with precision. In this study, we conduct a systematic literature review of HEp-2 cell se..."
118,24.5,RW:MedicalSegmentation,LeSAM: Adapt Segment Anything Model for Medical Lesion Segmentation.,Yunbo Gu; Qianyu Wu; Hui Tang; Xiaoli Mai,2024,IEEE journal of biomedical and health informatics,0,PubMed,masked_image_modeling_medical,10.1109/JBHI.2024.3406871,https://pubmed.ncbi.nlm.nih.gov/38809720/,"The Segment Anything Model (SAM) is a foundational model that has demonstrated impressive results in the field of natural image segmentation. However, its performance remains suboptimal for medical image segmentation, particularly when delineating lesions with irregular shapes and low contrast. This can be attributed to the significant domain gap between medical images and natural images on which ..."
119,24.5,"RW:Architecture, RW:KnowledgeDistillation, RW:MedicalSegmentation",Knowledge distillation on individual vertebrae segmentation exploiting 3D U-Net.,Luís Serrador; Francesca Pia Villani; Sara Moccia; Cristina P Santos,2024,Computerized medical imaging and graphics : the official journal of the Computerized Medical Imaging Society,0,PubMed,knowledge_distillation_medical_segmentation,10.1016/j.compmedimag.2024.102350,https://pubmed.ncbi.nlm.nih.gov/38340574/,"Recent advances in medical imaging have highlighted the critical development of algorithms for individual vertebral segmentation on computed tomography (CT) scans. Essential for diagnostic accuracy and treatment planning in orthopaedics, neurosurgery and oncology, these algorithms face challenges in clinical implementation, including integration into healthcare systems. Consequently, our focus lie..."
120,24.5,"RW:KnowledgeDistillation, RW:MedicalSegmentation, RW:Dataset",MSKD: Structured knowledge distillation for efficient medical image segmentation.,Libo Zhao; Xiaolong Qian; Yinghui Guo; Jiaqi Song,2023,Computers in biology and medicine,0,PubMed,knowledge_distillation_medical_segmentation,10.1016/j.compbiomed.2023.107284,https://pubmed.ncbi.nlm.nih.gov/37572439/,"In recent years, deep learning has revolutionized the field of medical image segmentation by enabling the development of powerful deep neural networks. However, these models tend to be complex and computationally demanding, posing challenges for practical implementation in clinical settings. To address this issue, we propose an efficient structured knowledge distillation framework that leverages a..."
121,24.0,"RW:MedicalSegmentation, RW:Dataset",SegWithU: Uncertainty as Perturbation Energy for Single-Forward-Pass Risk-Aware Medical Image Segmentation,Tianhao Fu; Austin Wang; Charles Chen; Roby Aldave-Garza,2026,arXiv,0,arXiv,"core_topic, masked_image_modeling_medical, catastrophic_forgetting_medical, ewc_lwf_replay_segmentation, sequential_organ_segmentation, unet_self_supervised_medical, knowledge_distillation_medical_segmentation, federated_ssl_medical_forgetting, medical_decathlon_benchmark_ssl",N/A,http://arxiv.org/abs/2604.15271v1,"Reliable uncertainty estimation is critical for medical image segmentation, where automated contours feed downstream quantification and clinical decision support. Many strong uncertainty methods require repeated inference, while efficient single-forward-pass alternatives often provide weaker failure ranking or rely on restrictive feature-space assumptions. We present $\textbf{SegWithU}$, a post-ho..."
122,24.0,General,Boundary-Centric Active Learning for Temporal Action Segmentation,Halil Ismail Helvaci; Sen-ching Samson Cheung,2026,arXiv,0,arXiv,"core_topic, masked_image_modeling_medical, ewc_lwf_replay_segmentation, sequential_organ_segmentation, unet_self_supervised_medical, knowledge_distillation_medical_segmentation, medical_decathlon_benchmark_ssl",N/A,http://arxiv.org/abs/2604.15173v1,"Temporal action segmentation (TAS) demands dense temporal supervision, yet most of the annotation cost in untrimmed videos is spent identifying and refining action transitions, where segmentation errors concentrate and small temporal shifts disproportionately degrade segmental metrics. We introduce B-ACT, a clip-budgeted active learning framework that explicitly allocates supervision to these high..."
123,24.0,"RW:Architecture, RW:MedicalSegmentation",Comparison of automated segmentation techniques for magnetic resonance images of the prostate.,Lars Johannes Isaksson; Matteo Pepa; Paul Summers; Mattia Zaffaroni,2023,BMC medical imaging,0,PubMed,masked_image_modeling_medical,10.1186/s12880-023-00974-y,https://pubmed.ncbi.nlm.nih.gov/36774463/,Contouring of anatomical regions is a crucial step in the medical workflow and is both time-consuming and prone to intra- and inter-observer variability. This study compares different strategies for automatic segmentation of the prostate in T2-weighted MRIs. This study included 100 patients diagnosed with prostate adenocarcinoma who had undergone multi-parametric MRI and prostatectomy. From the T2...
124,23.7,"RW:KnowledgeDistillation, RW:MedicalSegmentation","Enhancing efficient deep learning models with multimodal, multi-teacher insights for medical image segmentation",Khondker Fariha Hossain; S. Kamran; J. Ong; Alireza Tavakkoli,2025,Scientific Reports,8,Semantic Scholar,knowledge_distillation_medical_segmentation,10.1038/s41598-025-91430-0,https://www.semanticscholar.org/paper/0453ae125a46238be0d25758cf0ce078099ba1a6,"The rapid evolution of deep learning has dramatically enhanced the field of medical image segmentation, leading to the development of models with unprecedented accuracy in analyzing complex medical images. Deep learning-based segmentation holds significant promise for advancing clinical care and enhancing the precision of medical interventions. However, these models’ high computational demand and ..."
125,23.5,"RW:KnowledgeDistillation, RW:MedicalSegmentation",Adaptive Knowledge Transferring with Switching Dual-Student Framework for Semi-Supervised Medical Image Segmentation,Thanh-Huy Nguyen; Hoang-Thien Nguyen; B. Lam; Vi Vu,2025,Pattern Recognition,2,Semantic Scholar,knowledge_distillation_medical_segmentation,10.1016/j.patcog.2026.113115,https://www.semanticscholar.org/paper/a19102d36dc4089c083f22725f7d59e40312ae9e,"Teacher-student frameworks have emerged as a leading approach in semi-supervised medical image segmentation, demonstrating strong performance across various tasks. However, the learning effects are still limited by the strong correlation and unreliable knowledge transfer process between teacher and student networks. To overcome this limitation, we introduce a novel switching Dual-Student architect..."
126,23.5,RW:MedicalSegmentation,SAM-Med3D: A Vision Foundation Model for General-Purpose Segmentation on Volumetric Medical Images.,Haoyu Wang; Sizheng Guo; Jin Ye; Zhongying Deng,2025,IEEE transactions on neural networks and learning systems,0,PubMed,masked_image_modeling_medical,10.1109/TNNLS.2025.3586694,https://pubmed.ncbi.nlm.nih.gov/40742874/,"Existing volumetric medical image segmentation models are typically task-specific, excelling at specific targets but struggling to generalize across anatomical structures or modalities. This limitation restricts their broader clinical use. In this article, we introduce segment anything model (SAM)-Med3D, a vision foundation model (VFM) for general-purpose segmentation on volumetric medical images...."
127,23.5,General,Seeing Through Experts Eyes A Foundational Vision Language Model Trained on Radiologists Gaze and Reasoning,Kinhei Lee; Peiyuan Jing; Zhenxuan Zhang; Yue Yang,2026,arXiv,0,arXiv,sparse_masked_cnn_pretraining,N/A,http://arxiv.org/abs/2604.14316v1,"Large scale vision language models have shown promise in automating chest Xray interpretation, yet their clinical utility remains limited by a gap between model outputs and radiologist reasoning. Most systems optimize for semantic information without emulating how experts visually examine medical images, often overlooking critical findings or diverging from established diagnostic workflows. Radiol..."
128,23.5,"RW:KnowledgeDistillation, RW:MedicalSegmentation, RW:Dataset",Region Contrast Distillation for Medical Image Segmentation,Jiahao Pu; Wanli Dong; Jiachuan Fan; Ning Jiang,2025,IEEE International Joint Conference on Neural Network,0,Semantic Scholar,knowledge_distillation_medical_segmentation,10.1109/IJCNN64981.2025.11228818,https://www.semanticscholar.org/paper/28e078a62785732ffa8dcb64b082d08034512d81,"Recent advancements in deep learning have significantly boosted medical image segmentation, but the increasing number of parameters and computations pose challenges for deploying models in resource-constrained environments. To address this issue, we propose an effective structured knowledge transfer framework that uses a well-performing teacher model to train a lightweight student model. Specifica..."
129,23.5,"RW:KnowledgeDistillation, RW:MedicalSegmentation",Hybrid Knowledge Distillation for Generalizable Lightweight Models in Medical Image Recognition,Yu-Ting Lai; Cheng Huang; Tsung-Hsuan Lee; Ting-Yu Lin,2025,International Conference on Fuzzy Theory and Its Applications,0,Semantic Scholar,knowledge_distillation_medical_segmentation,10.1109/iFUZZY67152.2025.11286811,https://www.semanticscholar.org/paper/0caec5c66b6bfd0d8fd3f7c0d55794217977eab5,"This study addresses the challenge of deploying accurate yet computationally efficient models for medical image recognition. We propose a hybrid knowledge distillation (KD) strategy that integrates both response-based and feature-based approaches. The method strengthens a lightweight student network by enabling it to learn from a deeper teacher model, with joint optimization guided by a dual-loss ..."
130,23.5,"RW:KnowledgeDistillation, RW:MedicalSegmentation, RW:Dataset",Dynamic Co-Evolution Mechanism and Multi-View Collaborative Distillation Optimization for Semi-Supervised Medical Image Segmentation,Haoyu Yin; Jing Hu,2025,IEEE International Conference on Bioinformatics and Biomedicine,0,Semantic Scholar,knowledge_distillation_medical_segmentation,10.1109/BIBM66473.2025.11356546,https://www.semanticscholar.org/paper/51fbaa6d135d6047e1987c64500c20cab807664c,"Despite the ability of semi-supervised medical image segmentation to achieve superior results with limited labeled data and extensive unlabeled data, prevailing methods encounter a significant challenge: the detrimental cycle of pseudo-label noise resulting in model bias and error accumulation, which ultimately degrades performance. In this paper, we propose a differential teacher dynamic co-evolu..."
