Rank,RelevanceScore,SuggestedSection,Title,Authors,Year,Venue,Citations,Source,Cluster,DOI,URL,Abstract
131,23.5,"RW:SelfSupervisedLearning, RW:KnowledgeDistillation",M,Nana Jia; Tong Jia; Zhiao Zhang; Yanchao Zhang,2025,Neural networks : the official journal of the International Neural Network Society,0,PubMed,knowledge_distillation_medical_segmentation,10.1016/j.neunet.2025.107811,https://pubmed.ncbi.nlm.nih.gov/40694894/,"Patients with carotid atherosclerosis are at risk for cardiovascular disease, which may lead to death. The use of ultrasound image and clinical tabular data to predict the survival of patients is of great value for the treatment and prevention of cardiovascular disease. However, there are two main challenges in survival prediction of patient carotid atherosclerosis: (1) how to effectively fuse ult..."
132,23.5,"RW:KnowledgeDistillation, RW:MedicalSegmentation","Enhancing efficient deep learning models with multimodal, multi-teacher insights for medical image segmentation.",Khondker Fariha Hossain; Sharif Amit Kamran; Joshua Ong; Alireza Tavakkoli,2025,Scientific reports,0,PubMed,knowledge_distillation_medical_segmentation,10.1038/s41598-025-91430-0,https://pubmed.ncbi.nlm.nih.gov/40335579/,"The rapid evolution of deep learning has dramatically enhanced the field of medical image segmentation, leading to the development of models with unprecedented accuracy in analyzing complex medical images. Deep learning-based segmentation holds significant promise for advancing clinical care and enhancing the precision of medical interventions. However, these models' high computational demand and ..."
133,23.0,"RW:Architecture, RW:KnowledgeDistillation, RW:MedicalSegmentation",Research on Lightweight Spine X-ray Image Segmentation Algorithm Based on Knowledge Distillation,Dong Qing; Li Qi,2024,International Conference on Bioinformatics and Intelligent Computing,1,Semantic Scholar,knowledge_distillation_medical_segmentation,10.1145/3665689.3665713,https://www.semanticscholar.org/paper/875aad47159849a536e69d0d73bb08c8e70a6c40,"Spinal X-ray images find crucial roles in medical image processing, enabling precise spinal structure localization, detecting ischemia or lesions, and aiding surgical planning for clinical diagnosis and treatment. Rapid and accurate image segmentation, a vital aspect, saves significant time and effort for medical professionals. Knowledge distillation, a model compression technique, transfers insig..."
134,23.0,"RW:SelfSupervisedLearning, RW:Architecture, RW:KnowledgeDistillation, RW:MedicalSegmentation",A Medical Image Segmentation Method Combining Knowledge Distillation and Contrastive Learning,Xiaoxuan Ma Xiaoxuan Ma; Sihan Shan Xiaoxuan Ma; Dong Sui Sihan Shan,2024,電腦學刊,1,Semantic Scholar,knowledge_distillation_medical_segmentation,10.53106/199115992024063503024,https://www.semanticscholar.org/paper/a5fbf342b1379974de56b1ce911d7405ea9ba4cc,"
 Recent advances in feature-based knowledge distillation have shown promise in computer vision, yet their direct application to medical image segmentation has been challenging due to the inherent high intra-class variance and class imbalance prevalent in medical images. This paper introduces a novel approach that synergizes knowledge distillation with contrastive learning to enhance the performan..."
135,23.0,RW:Architecture,Comparative Analysis of nnUNet and MedNeXt for Head and Neck Tumor Segmentation in MRI-Guided Radiotherapy.,Nikoo Moradi; André Ferreira; Behrus Puladi; Jens Kleesiek,2025,"Head and Neck Tumor Segmentation for MR-Guided Applications : First MICCAI Challenge, HNTS-MRG 2024, held in conjunction with MICCAI 2024, Marrakesh, Morocco, October 17, 2024, proceedings",0,PubMed,masked_image_modeling_medical,10.1007/978-3-031-83274-1_10,https://pubmed.ncbi.nlm.nih.gov/40213035/,"Radiation therapy (RT) is essential in treating head and neck cancer (HNC), with magnetic resonance imaging (MRI)-guided RT offering superior soft tissue contrast and functional imaging. However, manual tumor segmentation is time-consuming and complex, and therefore remains a challenge. In this study, we present our solution as team TUMOR to the HNTS-MRG24 MICCAI Challenge which is focused on auto..."
136,23.0,RW:MedicalSegmentation,Polyp-DDPM: Diffusion-Based Semantic Polyp Synthesis for Enhanced Segmentation.,Zolnamar Dorjsembe; Hsing-Kuo Pao; Furen Xiao,2024,Annual International Conference of the IEEE Engineering in Medicine and Biology Society. IEEE Engineering in Medicine and Biology Society. Annual International Conference,0,PubMed,masked_image_modeling_medical,10.1109/EMBC53108.2024.10782077,https://pubmed.ncbi.nlm.nih.gov/40039822/,"This study introduces Polyp-DDPM, a diffusion-based method for generating realistic images of polyps conditioned on masks, aimed at enhancing the segmentation of gastrointestinal (GI) tract polyps. Our approach addresses the challenges of data limitations, high annotation costs, and privacy concerns associated with medical images. By conditioning the diffusion model on segmentation masks-binary ma..."
137,23.0,General,Two-view topogram-based anatomy-guided CT reconstruction for prospective risk minimization.,Chang Liu; Laura Klein; Yixing Huang; Edith Baader,2024,Scientific reports,0,PubMed,masked_image_modeling_medical,10.1038/s41598-024-59731-y,https://pubmed.ncbi.nlm.nih.gov/38653993/,"To facilitate a prospective estimation of the effective dose of an CT scan prior to the actual scanning in order to use sophisticated patient risk minimizing methods, a prospective spatial dose estimation and the known anatomical structures are required. To this end, a CT reconstruction method is required to reconstruct CT volumes from as few projections as possible, i.e. by using the topograms, w..."
138,22.6,"RW:KnowledgeDistillation, RW:MedicalSegmentation",Knowledge Distillation from Cross Teaching Teachers for Efficient Semi-Supervised Abdominal Organ Segmentation in CT,J. Choi,2022,FLARE@MICCAI,5,Semantic Scholar,knowledge_distillation_medical_segmentation,10.48550/arXiv.2211.05942,https://www.semanticscholar.org/paper/ed0dda3c21d222a0f416364a5b3ac867163e55f6,". For more clinical applications of deep learning models for medical image segmentation, high demands on labeled data and computational resources must be addressed. This study proposes a coarse-to-ﬁne framework with two teacher models and a student model that combines knowledge distillation and cross teaching, a consistency regularization based on pseudo-labels, for eﬃcient semi-supervised learnin..."
139,22.5,"RW:KnowledgeDistillation, RW:MedicalSegmentation, RW:Dataset",Medical Image Segmentation Approach via Transformer Knowledge Distillation,Tianshu Zhang; Hao Wang; K. Lam; Chi-Yin Chow,2023,CVIPPR,2,Semantic Scholar,knowledge_distillation_medical_segmentation,10.1145/3596286.3596292,https://www.semanticscholar.org/paper/d04fc1c0ebafc67b9fc93ce0e8d5ab340f5f6699,"Numerous transformer-based medical image segmentation methods have been proposed and achieved good segmentation results. However, it is still a challenge to train and deploy transformer networks to mobile medical devices due to a large number of model parameters. To resolve the training and model parameter problems, in this paper, we propose a Transformer-based network for Medical Image Segmentati..."
140,22.5,RW:Architecture,Simultaneous object detection and segmentation for patient-specific markerless lung tumor tracking in simulated radiographs with deep learning.,Lili Huang; Christopher Kurz; Philipp Freislederer; Farkhad Manapov,2024,Medical physics,0,PubMed,masked_image_modeling_medical,10.1002/mp.16705,https://pubmed.ncbi.nlm.nih.gov/37683107/,"Real-time tumor tracking is one motion management method to address motion-induced uncertainty. To date, fiducial markers are often required to reliably track lung tumors with X-ray imaging, which carries risks of complications and leads to prolonged treatment time. A markerless tracking approach is thus desirable. Deep learning-based approaches have shown promise for markerless tracking, but syst..."
141,22.0,"RW:KnowledgeDistillation, RW:MedicalSegmentation",Uncertainty Driven Adaptive Self-Knowledge Distillation for Medical Image Segmentation,Xutao Guo; Mengqi Wang; Yang Xiang; Yanwu Yang,2025,IEEE Transactions on Emerging Topics in Computational Intelligence,2,Semantic Scholar,knowledge_distillation_medical_segmentation,10.1109/TETCI.2025.3526259,https://www.semanticscholar.org/paper/c8517883bff9c9663f813de75a5b3a8164270afc,"Deep learning has recently significantly improved the precision of medical image segmentation. However, due to the commonly limited dataset scale and reliance on hard labels (one-hot vectors) in medical image segmentation, deep learning models often overfit, which reduces segmentation performance. To mitigate the problem, we propose an uncertainty driven adaptive self-knowledge distillation (UAKD)..."
142,22.0,"RW:SelfSupervisedLearning, RW:Architecture",TokenGS: Decoupling 3D Gaussian Prediction from Pixels with Learnable Tokens,Jiawei Ren; Michal Jan Tyszkiewicz; Jiahui Huang; Zan Gojcic,2026,arXiv,0,arXiv,"core_topic, sparse_masked_cnn_pretraining, unet_self_supervised_medical",N/A,http://arxiv.org/abs/2604.15239v1,"In this work, we revisit several key design choices of modern Transformer-based approaches for feed-forward 3D Gaussian Splatting (3DGS) prediction. We argue that the common practice of regressing Gaussian means as depths along camera rays is suboptimal, and instead propose to directly regress 3D mean coordinates using only a self-supervised rendering loss. This formulation allows us to move from ..."
143,22.0,RW:SelfSupervisedLearning,Self-supervised segmentation and characterization of fiber bundles in anatomic tracing data.,Vaanathi Sundaresan; Julia F Lehman; Chiara Maffei; Suzanne N Haber,2025,"Imaging neuroscience (Cambridge, Mass.)",0,PubMed,core_topic,10.1162/imag_a_00514,https://pubmed.ncbi.nlm.nih.gov/40800953/,"Anatomic tracing is the gold standard tool for delineating brain connections and for validating more recently developed imaging approaches such as diffusion MRI tractography. A key step in the analysis of data from tracer experiments is the careful, manual charting of fiber trajectories on histological sections. This is a very time-consuming process, which limits the amount of annotated tracer dat..."
144,22.0,RW:MedicalSegmentation,Automated classification of oral cancer lesions: Vision transformers vs radiomics.,Eva Chilet-Martos; Joan Vila-Francés; José V Bagan; Yolanda Vives-Gilabert,2025,Computers in biology and medicine,0,PubMed,masked_image_modeling_medical,10.1016/j.compbiomed.2025.109913,https://pubmed.ncbi.nlm.nih.gov/40020550/,"Early diagnosis is paramount in the effective management of oral cancer, offering numerous benefits including improved treatment outcomes, reduced morbidity and mortality, preservation of function and appearance, cost-effectiveness, and enhanced quality of life for patients. Transformer-based models, increasingly used in medical image analysis, are the focus of our study. We aim to compare a visio..."
145,22.0,General,The Courtroom Trial of Pixels: Robust Image Manipulation Localization via Adversarial Evidence and Reinforcement Learning Judgment,Songlin Li; Zhiqing Guo; Dan Ma; Changtao Miao,2026,arXiv,0,arXiv,sparse_masked_cnn_pretraining,N/A,http://arxiv.org/abs/2604.14703v1,"Although some existing image manipulation localization (IML) methods incorporate authenticity-related supervision, this information is typically utilized merely as an auxiliary training signal to enhance the model's sensitivity to manipulation artifacts, rather than being explicitly modeled as localization evidence opposing the manipulated regions. Consequently, when manipulation traces are subtle..."
146,22.0,"RW:KnowledgeDistillation, RW:MedicalSegmentation, RW:Dataset",Mask-Enhanced Edge-Aware Knowledge Distillation for Medical Image Segmentation,Guangjun Zhu; Xiangchun Yu,2025,International Conference Civil Engineering and Architecture,0,Semantic Scholar,knowledge_distillation_medical_segmentation,10.1109/ICCEA65460.2025.11103048,https://www.semanticscholar.org/paper/e4ae4db4fc79c53dab08fb07abad0386abb8a129,"Knowledge distillation has become a key paradigm for transferring knowledge from large-scale teacher models to compact student networks, effectively balancing computational efficiency with performance retention. In this paper, we propose a knowledge distillation method based on a mask adaptive mechanism, which efficiently transfers the rich feature information from a high-performance teacher netwo..."
147,21.6,"RW:KnowledgeDistillation, RW:MedicalSegmentation",Knowledge distillation with ensembles of convolutional neural networks for medical image segmentation,Julia M. H. Noothout; N. Lessmann; M. V. van Eede; Louis D. van Harten,2022,Journal of Medical Imaging,29,Semantic Scholar,knowledge_distillation_medical_segmentation,10.1117/1.JMI.9.5.052407,https://www.semanticscholar.org/paper/0aabb1a4831d724bf28ef9a9a0d7bde6a1bb2ea7,"Abstract. Purpose: Ensembles of convolutional neural networks (CNNs) often outperform a single CNN in medical image segmentation tasks, but inference is computationally more expensive and makes ensembles unattractive for some applications. We compared the performance of differently constructed ensembles with the performance of CNNs derived from these ensembles using knowledge distillation, a techn..."
148,21.6,"RW:KnowledgeDistillation, RW:MedicalSegmentation",DistillMatch: Revisiting Self-Knowledge Distillation in Semi-Supervised Medical Image Segmentation,Chunshi Wang; Bin Zhao; Zhiyang Liu,2024,IEEE International Conference on Bioinformatics and Biomedicine,3,Semantic Scholar,knowledge_distillation_medical_segmentation,10.1109/BIBM62325.2024.10821816,https://www.semanticscholar.org/paper/0e264ec0e0af8fd2bfd5e06aa1026f94a3fdf954,"Semi-supervised medical image segmentation still faces challenges although it is able to obtain better segmentation results using a small amount of labeled data and a large amount of unlabeled data. Despite the progress made by current methods in utilizing unlabeled data, they fail to exploit the full potential of labeled data in terms of improving model performance. In this paper, we propose a se..."
149,21.5,RW:KnowledgeDistillation,KDLight: A Lightweight Knowledge Distillation Framework for Medical Image Classification,S. Khan; Omair Bilal; Sajib Mistry; Novarun Deb,2025,IEEE International Joint Conference on Neural Network,1,Semantic Scholar,knowledge_distillation_medical_segmentation,10.1109/IJCNN64981.2025.11228615,https://www.semanticscholar.org/paper/0f1231193530415969121a0b12fff882e9307305,"Conventional standalone approaches for diagnosing individual diseases often fail to achieve robust generalization because they are severely impacted by overfitting. This results in poor adaptability to diverse image representations and an inability to balance performance with computational efficiency. In this study, we propose KDLight, a lightweight, novel CNN model designed for efficient medical ..."
150,21.5,"RW:KnowledgeDistillation, RW:MedicalSegmentation, RW:Dataset",Feature denoising distillation for medical image segmentation,Qiaoyi Chen; Xiangchun Yu,2024,International Conference on Image Processing and Intelligent Control,1,Semantic Scholar,knowledge_distillation_medical_segmentation,10.1117/12.3038513,https://www.semanticscholar.org/paper/3eadbcf245c3f2f9f73a4e7f82e13598c219feaa,"Deep convolutional neural networks have achieved remarkable progress in medical image segmentation, yet these large-scale models often require extended inference times. There is an urgent need for lightweight models, and knowledge distillation has emerged as a pivotal focus of current research. This paper introduces a novel knowledge distillation framework, designated as ISKD. Unlike traditional m..."
151,21.5,General,Ensemble Deep Learning Models for Automated Segmentation of Tumor and Lymph Node Volumes in Head and Neck Cancer Using Pre- and Mid-Treatment MRI: Application of Auto3DSeg and SegResNet.,Dominic LaBella,2025,"Head and Neck Tumor Segmentation for MR-Guided Applications : First MICCAI Challenge, HNTS-MRG 2024, held in conjunction with MICCAI 2024, Marrakesh, Morocco, October 17, 2024, proceedings",0,PubMed,masked_image_modeling_medical,10.1007/978-3-031-83274-1_21,https://pubmed.ncbi.nlm.nih.gov/40201772/,"Automated segmentation of gross tumor volumes (GTVp) and lymph nodes (GTVn) in head and neck cancer using MRI presents a critical challenge with significant potential to enhance radiation oncology workflows. In this study, we developed a deep learning pipeline based on the SegResNet architecture, integrated into the Auto3DSeg framework, to achieve fully-automated segmentation on pre-treatment (pre..."
152,21.5,"RW:KnowledgeDistillation, RW:MedicalSegmentation",CPKD: channel-wise and pixel-wise relational knowledge distillation for medical image segmentation,Ziyun Xiong; Xiangchun Yu,2024,International Conference on Image Processing and Artificial Intelligence,0,Semantic Scholar,knowledge_distillation_medical_segmentation,10.1117/12.3035260,https://www.semanticscholar.org/paper/e043ff0ff50d6fe45953c43b91430d13b1838c18,"Deep neural networks have demonstrated remarkable performance in medical image segmentation tasks. Nevertheless, their efficacy often comes at the cost of high model complexity and sluggish inference speeds. To address these limitations, we explore a new channel-level and pixel-level relational knowledge distillation (CPKD) method to efficiently transfer the abundant relational knowledge from the ..."
153,21.2,"RW:KnowledgeDistillation, RW:MedicalSegmentation, RW:Dataset",ACT-NET: Asymmetric Co-Teacher Network for Semi-Supervised Memory-Efficient Medical Image Segmentation,Ziyuan Zhao; An Zhu; Zeng Zeng; B. Veeravalli,2022,International Conference on Information Photonics,11,Semantic Scholar,knowledge_distillation_medical_segmentation,10.1109/ICIP46576.2022.9897494,https://www.semanticscholar.org/paper/6f822ae6db06512906816a74327833fdd87cc6f1,"While deep models have shown promising performance in medical image segmentation, they heavily rely on a large amount of well-annotated data, which is difficult to access, especially in clinical practice. On the other hand, high-accuracy deep models usually come in large model sizes, limiting their employment in real scenarios. In this work, we propose a novel asymmetric co-teacher framework, ACT-..."
154,21.2,"RW:SelfSupervisedLearning, RW:KnowledgeDistillation, RW:MedicalSegmentation",Exploring Generalizable Distillation for Efficient Medical Image Segmentation,Xingqun Qi; Zhuo Wu; Min Ren; Muyi Sun,2022,IEEE journal of biomedical and health informatics,9,Semantic Scholar,knowledge_distillation_medical_segmentation,10.1109/JBHI.2024.3385098,https://www.semanticscholar.org/paper/ae493136258a29c3bfc7c3b105faa36bb3f06852,"Efficient medical image segmentation aims to provide accurate pixel-wise predictions with a lightweight implementation framework. However, existing lightweight networks generally overlook the generalizability of the cross-domain medical segmentation tasks. In this paper, we propose Generalizable Knowledge Distillation (GKD), a novel framework for enhancing the performance of lightweight networks o..."
155,21.0,RW:MedicalSegmentation,COVID-19 Severity Prediction from Chest X-ray Images Using an Anatomy-Aware Deep Learning Model.,Nusrat Binta Nizam; Sadi Mohammad Siddiquee; Mahbuba Shirin; Mohammed Imamul Hassan Bhuiyan,2023,Journal of digital imaging,0,PubMed,masked_image_modeling_medical,10.1007/s10278-023-00861-6,https://pubmed.ncbi.nlm.nih.gov/37369941/,"The COVID-19 pandemic has been adversely affecting the patient management systems in hospitals around the world. Radiological imaging, especially chest x-ray and lung Computed Tomography (CT) scans, plays a vital role in the severity analysis of hospitalized COVID-19 patients. However, with an increasing number of patients and a lack of skilled radiologists, automated assessment of COVID-19 severi..."
156,20.5,RW:SelfSupervisedLearning,Diagnosing LLM Judge Reliability: Conformal Prediction Sets and Transitivity Violations,Manan Gupta; Dhruv Kumar,2026,arXiv,0,arXiv,"masked_image_modeling_medical, sparse_masked_cnn_pretraining",N/A,http://arxiv.org/abs/2604.15302v1,"LLM-as-judge frameworks are increasingly used for automatic NLG evaluation, yet their per-instance reliability remains poorly understood. We present a two-pronged diagnostic toolkit applied to SummEval: $\textbf{(1)}$ a transitivity analysis that reveals widespread per-input inconsistency masked by low aggregate violation rates ($\barρ = 0.8$-$4.1\%$), with $33$-$67\%$ of documents exhibiting at l..."
157,20.5,General,MCSC-Bench: Multimodal Context-to-Script Creation for Realistic Video Production,Huanran Hu; Zihui Ren; Dingyi Yang; Liangyu Chen,2026,arXiv,0,arXiv,sequential_organ_segmentation,N/A,http://arxiv.org/abs/2604.15127v1,"Real-world video creation often involves a complex reasoning workflow of selecting relevant shots from noisy materials, planning missing shots for narrative completeness, and organizing them into coherent storylines. However, existing benchmarks focus on isolated sub-tasks and lack support for evaluating this full process. To address this gap, we propose Multimodal Context-to-Script Creation (MCSC..."
158,20.5,General,Building Extraction from Remote Sensing Imagery under Hazy and Low-light Conditions: Benchmark and Baseline,Feifei Sang; Wei Lu; Hongruixuan Chen; Sibao Chen,2026,arXiv,0,arXiv,knowledge_distillation_medical_segmentation,N/A,http://arxiv.org/abs/2604.15088v1,"Building extraction from optical Remote Sensing (RS) imagery suffers from performance degradation under real-world hazy and low-light conditions. However, existing optical methods and benchmarks focus primarily on ideal clear-weather conditions. While SAR offers all-weather sensing, its side-looking geometry causes geometric distortions. To address these challenges, we introduce HaLoBuilding, the ..."
159,20.5,General,Implicit Neural Representations: A Signal Processing Perspective,Dhananjaya Jayasundara; Vishal M. Patel,2026,arXiv,0,arXiv,knowledge_distillation_medical_segmentation,N/A,http://arxiv.org/abs/2604.15047v1,"Implicit neural representations (INRs) mark a fundamental shift in signal modeling, moving from discrete sampled data to continuous functional representations. By parameterizing signals as neural networks, INRs provide a unified framework for representing images, audio, video, 3D geometry, and beyond as continuous functions of their coordinates. This functional viewpoint enables signal operations ..."
160,20.2,RW:KnowledgeDistillation,SRKD: Towards Efficient 3D Point Cloud Segmentation via Structure- and Relation-aware Knowledge Distillation,Yuqi Li; Junhao Dong; Zeyu Dong; Chuanguang Yang,2025,arXiv.org,10,Semantic Scholar,knowledge_distillation_medical_segmentation,10.48550/arXiv.2506.17290,https://www.semanticscholar.org/paper/689a0af35f5f06499bb111edddd9a9e1f02ada41,"3D point cloud segmentation faces practical challenges due to the computational complexity and deployment limitations of large-scale transformer-based models. To address this, we propose a novel Structure- and Relation-aware Knowledge Distillation framework, named SRKD, that transfers rich geometric and semantic knowledge from a large frozen teacher model (>100M) to a lightweight student model (<1..."
161,20.2,"RW:KnowledgeDistillation, RW:MedicalSegmentation",Shape-intensity knowledge distillation for robust medical image segmentation,Wen-Wen Dong; Bo Du; Yongchao Xu,2024,Frontiers of Computer Science,8,Semantic Scholar,knowledge_distillation_medical_segmentation,10.1007/s11704-024-40462-2,https://www.semanticscholar.org/paper/a5698d206fe979ba8ed1ddfc569f2df05dfa4ccf,"Many medical image segmentation methods have achieved impressive results. Yet, most existing methods do not take into account the shape-intensity prior information. This may lead to implausible segmentation results, in particular for images of unseen datasets. In this paper, we propose a novel approach to incorporate joint shape-intensity prior information into the segmentation network. Specifical..."
162,20.1,"RW:SelfSupervisedLearning, RW:KnowledgeDistillation, RW:MedicalSegmentation, RW:Dataset",ScribSD+: Scribble-supervised medical image segmentation based on simultaneous multi-scale knowledge distillation and class-wise contrastive regularization,Yijie Qu; Tao Lu; Shaoting Zhang; Guotai Wang,2024,Comput. Medical Imaging Graph.,6,Semantic Scholar,knowledge_distillation_medical_segmentation,10.1016/j.compmedimag.2024.102416,https://www.semanticscholar.org/paper/6368afd17f11b43e74ece0f3e4f34b87d4729aa7,"Despite that deep learning has achieved state-of-the-art performance for automatic medical image segmentation, it often requires a large amount of pixel-level manual annotations for training. Obtaining these high-quality annotations is time-consuming and requires specialized knowledge, which hinders the widespread application that relies on such annotations to train a model with good segmentation ..."
